{
  "bundleId": "0d38bbb9268262df239f4e7c1655bb4b609d30988aebab6b6a07e3dc550deb47",
  "ordinal": 0,
  "schema": "FbxMappingReviewShard.v1",
  "shardId": "6b0d3aea6478bd9fee49cc3a0bbdde7616cb7884a8b1a40f20de09ec1871bb9f",
  "sourceGraphCanonicalSha256": "074d508c10bcd3fae5903d65447fb56c63cc909a2aeb3108b9f47df127d3748e",
  "workItems": [
    {
      "geometryEvidence": [
        {
          "geometryObjectId": "604",
          "governedPointCount": 2,
          "kind": "MESH",
          "pointAuthority": "MESH_VERTEX"
        }
      ],
      "nameEvidence": {
        "authority": "NON_AUTHORITATIVE",
        "displayName": "Model::Flange",
        "domClass": "Model",
        "domSourceName": "Model::Flange",
        "domSubtype": "Mesh"
      },
      "reviewState": "PENDING",
      "sourceGeometryObjectIds": [
        "604"
      ],
      "sourceModelObjectId": "504",
      "sourceOccurrenceId": "occ:504",
      "sourceRecordDisposition": "supported-occurrence",
      "typeEvidence": {
        "nodeAttributeType": "MESH",
        "nodeAttributeTypeValue": 2,
        "sourceDocumentOrder": 9,
        "ufbxElementId": 9,
        "ufbxElementType": "NODE",
        "ufbxElementTypeValue": 1,
        "ufbxTypedId": 5
      },
      "workItemId": "work-05fe79465c813df137db1102f34f6ba12dc54c28eda472d32314267aeb55be1e"
    },
    {
      "geometryEvidence": [
        {
          "geometryObjectId": "600",
          "governedPointCount": 2,
          "kind": "MESH",
          "pointAuthority": "MESH_VERTEX"
        }
      ],
      "nameEvidence": {
        "authority": "NON_AUTHORITATIVE",
        "displayName": "Model::MainPipe",
        "domClass": "Model",
        "domSourceName": "Model::MainPipe",
        "domSubtype": "Mesh"
      },
      "reviewState": "PENDING",
      "sourceGeometryObjectIds": [
        "600"
      ],
      "sourceModelObjectId": "500",
      "sourceOccurrenceId": "occ:500",
      "sourceRecordDisposition": "supported-occurrence",
      "typeEvidence": {
        "nodeAttributeType": "MESH",
        "nodeAttributeTypeValue": 2,
        "sourceDocumentOrder": 1,
        "ufbxElementId": 1,
        "ufbxElementType": "NODE",
        "ufbxElementTypeValue": 1,
        "ufbxTypedId": 1
      },
      "workItemId": "work-1776b9d843317ab6e7f3c91b985045c6f167a04bbd088e0781c13370ced9dae9"
    }
  ],
  "worklistId": "e0023b4b94c88915f00898e1abf12a8fa4949733347fd203067c70c54aaf523f"
}
